au;5;As soon as I downloaded this, Bill Gates appeared and tried to give me a vaccine without my permission.  Luckily my 5G protective suit saved me.
au;4;I think it’d be very handy if there was an option to view or check stats on “contact” data collected by the app. This would allow users to check for themselves if the app was actually working and/or how well it works with their iPhone locked in their pocket.
au;1;I downloaded the app and tried to put my details in but every 5 seconds the screen goes to black and it says “covidsafe” I tried restarting my phone and even deleting the app and re-downloading it but nothing worked. Probably just a glitch but it’s stopping me from registering.
au;5;Everyone get on board
au;5;I want to see my friends and family, hurry up and download.
au;3;I just want to go back to school and if this helps I’ll do it.
au;3;"...not very clear how it’s actually implemented. The notification sent every morning implies you need the app open on your screen to be effective. Why not take a little extra time to develop something that works in the background? Sure, millions might download, but if it’s a requirement to keep it open and few do, it’s not gonna help much.

Also, the daily notification is annoying. When I turned notifications off, the app implied it would no longer work without it. Want to help, but do I really need a notification every morning to do so?

Minus one star for each of the above, but 3 stars for: a simple on boarding process; a clean design; and for getting it out quickly. Hoping it still works in the background!"
au;3;My partner is from Canada, but cannot download the app. I'm sure there are thousands of other people in the same boat. Any way of making it available to all App Store regions?
au;3;Looks like the app is sleeping and/or switching off if it has not been in the foreground for a while.
au;2;"Whilst the app is an excellent idea the implementation leaves a lot to be desired.
The daily ‘alert’ messages which are just advertising were distracting and annoying.
I disabled alerts for the app and then the app said they are required.
There is no explanation why, and of course the government has gone back on its promise to open source the app and release an independent security audit report.
So thanks but no thanks."
au;1;"It has made me re-register a new account every day this week so clearly its stats about users are way out. I got fed up and deleted the ap. 
There is no place myself and my phone is going to be near anyone for 15 minutes so it's never going to measure anything of use."
au;5;There has never been a scenario like this since tech played such a part in our lives. Please get the app and make sure people who may get infected know about it!
au;1;"As reported by News.com.au and within the app itself, the app must be open with your screen turned on to track Contacts.

I can’t leave my phone unlocked whilst I’m roaming public places as this is specifically the time I want my phone protected by security.

The app constantly sends notifications asking to open the app and leave it in power save mode, for your reference, power save mode is when you open the app and place your phone either upside down or face down.

I’m really sad that iOS users aren’t able to reliably do our part to help!"
au;5;After researching privacy protection and against my very strong distrust of big government monitoring systems I decided to download the app. The installation was very easy n quick. Hopefully my decision was a correct one.
au;1;bad
au;3;Pretty sure it needs to be running in the foreground or at least reopened frequently to work, really annoying pop ups, would be better if it used the Apple API
au;3;If this app can be installed on smartwatches, it would be better. Some places don’t allow phones like certain workplaces. It is also better to run this app on the background in smartwatches.
au;1;"I've deleted this junk app. It doesn't function correctly. I don't want notifications on, period! Bluetooth Sharing is a security risk, like writing your password down on paper and putting it on display in a public place. Other apps have been able to successfully implement ""Background App Refresh"" without the app having to be open, or running in the tray. Many times I've left the house or gone to the shops, I always forget to make sure it's running, mainly because it's not an app I actively use. Set and Forget would be best for this app to function. Apple have integrated Covid-19 support in an upcoming update which therefore make this app redundant. There is a slim chance you will find this working when passing another person with it running as you've designed."
au;1;What good is the app if someone is active with the virus and they don’t use the app, then the app is useless
au;1;An absolutely useless app that doesn’t work unless you walk around with your phone unlocked and the app open. Counting download rates doesn’t count the apps effectiveness.
au;3;iOS implementation is poor - the app needs to run in the background once installed and not shut off when inadvertently closed down...
au;1;"I don’t like that I am asked to provide my name and contact number to sign up.
Why can’t they just alert me through the app rather than contacting me via phone?"
au;4;Every day! The app annoys me by saying “We need you” I downloaded the app so I’d be advised if I’d been in contact with someone who had the virus but the daily message is really annoying especially as, when I go in to the app, it says “you don’t need to do anything else”. Developers please note- if you continue to annoy me I will delete the app. EDIT - ok, I get it now. You open the app & leave it open. The Bluetooth is only active if your phone is unlocked & by opening the app, your phone won’t auto-lock after 5 minutes (or whatever your setting is). But if it sends me another message tomorrow ........
au;1;This app isn’t developed properly it has flaws such as black screen popping up ever few seconds saying covidsafe, text messages not coming through, logins constantly.
au;5;Wouldn’t send a pin at first because I had the wifi on using my home internet but once I turned wifi off the setup was easy.
au;3;The app is currently only available in the AU store.  However, with the many international students and migrants in Australia who are still in their original country’s store, there is no way for them to access and download the app, even if they wanted to. Might be worth making the app available in all international stores.
au;5;Download and protect Australia - it’s as simple as that!
au;1;Please STOP sending daily reminders to leave Bluetooth on
au;5;no problems with download and install to iphone 8+
au;3;I just downloaded it and everything but I found that anytime my phone is close to me the screen for the app blacks out and just has “COVIDSafe” in the middle. I moved the screen away and then it went back to normal, it’s like every time it’s facing me it’s “COVIDSafe” but then I tilt it slightly and it has the app working. Don’t know if this just glitch or feature of the app.
au;1;I am using this on my new iPad as I don’t use a smartphone. Not sure what the problem is but every morning the app is asking me to input my information and register again even though I successfully registered and got the screen saying I do not need to do anything further. I am not sure how, but eventually if I close the app a few times and reopen it, it gives me the screen showing I am already registered and the pulsating shield screen. If this keeps happening I will delete it in a few days. Can’t find anywhere to send feedback to directly, or get any support so I hope someone is reading these feedbacks. The APP SUPPORT BUTTON just takes you to a faq page with no contact details re: the app so that is useless. Also the frequent notifications about running the app are pointless and really annoying. This was obviously a rush job stupidly.
au;4;I understand the need for this app but it seems a little pointless. As I’m as hearing to the social distancing regulations the only people who I’m ever in contact with for more than 15 minutes are the people in my house. The most likely place I’m going to contact this virus is while shopping and the people I pass in the shops won’t be registered. The serving problem with it is Bluetooth which I need to remember to turn on when I leave the house but turn off at home or my phone automatically connects to random home devices.
au;1;"If indeed the contact tracing works best (or maybe only) when the app is open on the screen and the screen unlocked (and my phone did not automatically lock after the set time when this was the case and I wasn’t holding it)  then the battery will drain very quickly and it’s also a major security risk if we   lose sight of our phones for a moment or more. 
Running as a background app would make much more sense. 
Also conflicting information has been given re running the app in power saver mode or not."
au;1;"Why does the app keep sending a notification 3-4 a day telling me to keep Bluetooth on when is already turned on? 

Very annoying. Now turning the notifications for it OFF!"
au;3;The only notifications the app sends me seem to imply that I’ve turned it off. But it’s always on except in one situation. When I’m with a client trying to take a payment using the Square payment app, I have to close COVIDSafe because it causes the Bluetooth card reader to lose contact. And that’s about the only situation when I’m anywhere near anyone outside my family, so it loses its usefulness.
au;4;Notifications keep popping up telling me to turn on Bluetooth and have the app running in the background - when I have done both already and am using the app correctly. This is annoying and may result in people deleting the app from frustration.
au;1;I am getting logged out every single night as is my mother who lives miles away from me. We both have left it running in the background with Bluetooth turned on and are finding each morning asking use to use the APP. What are we doing wrong?
au;5;Although I’m not sold on this helping as much as they claim but we gotta try. I mean we’ve all sold our backsides to google, Facebook etc already. This app collects less data that those so although Im big on privacy, I can’t argue against this whilst still using google and Facebook. Which I do. Let’s beat the damn rona!!!!
au;3;Are you looking into the API from Apple and Google so that the app can work more natively with iOS?
au;5;Stay home, stay safe
au;1;I have downloaded the app and all I see is the black screen that says “COVIDSafe”. When I try to switch apps the screen with the explanations appears but when I go back to the app the black screen is still there and it doesn’t let me select any options or proceed. Basically I cannot use the app. I have tried closing and opening the app but still the same black “COVIDSafe” screen that doesn’t let me do anything.
au;2;Won’t go past the home screen - quickly flickers to the next screen and then crashes. iPhone X with updated iOS
au;1;"Sunday:
Error verifying mobile number!  

Number was entered correctly (with and without leading 0)

Monday to Thursday:
A couple of times per day, I’m asked to run the app in background 

Today, it asks me to turn on Bluetooth.  I must have amazing AirPods because I had been and continued to listen to podcasts before, during and after this alert. 

I hope the next iteration addresses this annoyance. 

Also, I’d like some indication it’s functioning as designed either by being able to list detections or a display of the detection count."
au;3;This morning I was using my iPhone 6 and Apple ear buds on Bluetooth to listen to the radio.  Of the ten people who passed by my buds/phone cut out five times as we crossed.  Could only put it down to app pinging?
au;3;After some install hassles it now appears to be working.
au;1;"Unable to register onto this app. It has constantly rejected my access code -037086. 

It referred me back to the system administrator. I have been trying to do so.
Every time I try to reregister I don’t get a new access code number. When I use the only number applied I get rejected and told to try again.

Just too too frustrating."
au;4;"This is a great app with a brilliant concept but I’m unable to multitask on my phone and still have it tracking; it doesn’t track while the app isn’t open. Would be awesome to have as a constant background tracker and be able to work with my phone locked in my pocket."
au;5;Easy to install and it seems to work as it should 👍🏼
au;1;"Had to disable notifications because it kept sending me daily alerts telling me to use the app... Which I was.

App now won't work with notifications disabled so thinking I may as well uninstall. Now won't show anything but a prompt to enable notifications again."
au;4;Overall works fine but keeps disrupting my AirPods when listening to music which is annoying because when I’m out it’s the only time when I use them and, at the same time, it is critical that the app keeps connected. Please look into it, as others are also experiencing the same issue.
au;1;I’ve downloaded, deleted and downloaded again on a number of seperate occasions and I still can’t get past the mobile phone number verification stage
au;2;Not impressed with the app when u have to keep the Bluetooth on and if u turn it off it keeps reminding you to turn it back on. Doesn’t really tell you where or whom who has it
au;2;Titles says it, app will make you sign up again every few days. Unsure wether it’s actually doing any tracking while it’s offline but seems a bit pointless me needing to signup again so often. If the app developers can’t figure out how to save a login token on a device I doubt their ability to securely store peoples sensitive data.
au;5;this is a perfect app and safe to use!
au;5;"Will help us all get back to normal soon if  all Australians download this App without worrying about battery life, privacy issues
I found it has very little battery drain and certainly fell safer shopping 
DOWNLOAD TODAY"
au;1;App won’t accept a valid phone number when registering. Cannot use app at all.
au;5;"This is a great app. The more people download it, the sooner we’ll be back to normal. 

My only issue is that it’s only available in the Australian App Store. I have friends who are expats living in Australia who want to download the app but are unable to because they still use the global/another country’s App Store. This is much like the people in Australia without Australian mobile numbers. If both of these things could be fixed, that’d be helpful.

I wonder if the developers could maybe just geofence Australia and then open the app for everyone to use?

Just a thought."
au;3;I went out to the shops yesterday and my iPhone 8 was flat by the time I was having an X-ray. So the issue is battery life.
au;1;It keeps asking me for my information eveytime I open the app
au;2;The idea of this app is great. But only if it can actually work. I’ve spent 10 minutes on this app already and haven’t even got to the “I consent” button because it keeps glitching out to the “COVIDSafe” black screen...?
au;3;"The Singapore version of this app requires it to be kept in the foreground and says that. This version says ‘open’ and the minister has said it has fixed the problems that require foreground. 

Can we get an answer as to if it needs to be in the foreground to work?"
au;5;"I installed the app, it was easy to install and seems working OK but since the app doesn’t give live feedback to the user due to the privacy of other users, there is no practical way to know if it is working as it should be. 

My main concern and suggestion is that it only works on the phone and not on the watch. Phones are not easy to sanitise each time you go out and come back that is why, whenever I go grocery shopping i only have my Apple Watch with me since I can have my calls, texts and payments with it and I can wash it while washing my hands when I come home. Therefore my phone shows no contact with anyone."
au;1;Download app ok, register details ok, but the approval to upload info won’t work. It states that a sms with number would be sent to my phone but does not happen. What to do?
au;1;"Asks me to sign up again every morning. Gets tiring after a couple of days. 
iPhone 11 Pro 13.4.1
Why can’t we simply use the Apple/google developed API
Goodbye app. Delete."
au;4;Easy app to install but I am getting a notification every day telling me to keep it open and running in background. Issue is - I am receiving this notification when it is open! Please only trigger this when it isn’t open if you can!
au;3;Why do I need a notification every day to tell me to keep it on. I have now turned off notifications so hopefully it still works. I do shift work so a reminder at 9am is a fail.
au;1;Look, I really want to help stop the spread and I really don't mind having the app installed and running but I've uninstall coz I'm fken sick and tired of the spammy notifications every single day. Get rid of this bloatware.
au;4;App open and running and twice a day I’m getting an alert to open the app and turn my Bluetooth on. It is open and it is on. An important app we should all have but stop beating us over the head with it when we’re already doing the right thing.
au;1;"It continues to ask me to re-register.

Have submitted a support email and just get automated responses.

One more useless app destined to be uninstalled."
au;3;I downloaded and set up the app about 3 days ago and it was running fine, but this morning it made me set it up again. If this happens every few days it will get annoying and also is a risk that the app can’t fulfill its function properly if users have to re-enter their details every few days. Hopefully it was just a one off!
au;3;App doesn’t seem to be working in the background, as I keep receiving reminders about it.
au;1;"It asking me to register every day, I enter my details...

I’ve emailed you as to what you mean by keep the app open when out

WhT do you mean???? Load it and leave it on the screen? It’s installed, surely that’s what you mean, when I’m out, I’m using my phone

I emailed this question to you 3 days ago and just had a generic useless reply on the quick reference guide which doesn’t clarify this question

I don’t see the point of it, currently it’s not working until I register my details again, 4th day in a row

I think I’ll just delete it..."
au;2;This app can only be used by Iphones 6 and newer. Any one with an older Iphone cannot use it. If you want more people to use the app create an app for older phones.
au;3;This may turnout to be pointless if you don’t allow for additional tracking. Many people would gladly give their location details if you let them. Appeasing the privacy lobbyists is fine but obviously if the modelling shows 40% of the population need the app to be effective then over 70% of smartphones users need the app, 3 million is nowhere near enough. Allowing people to volunteer their information will make it more effective, it wouldn’t be a difficult program change. Please let people help.
au;4;More reliable than Barnaby Joyce’s condoms in the secretary’s office.
au;5;"For the non-tech ppl, it is a small app only 12.5MB 🧐I hope our small contribution here truly helps us all.
Also note you cannot add an emoji to your ‘Firstname Surname’ field when registering your details in the app, you’ll get a false error that your number couldn’t be verified."
au;1;I tried downloading and registering but when I open the app the screen just keeps flashing from the register screen to a black screen that says covidsafe. It’s making it hard to read and put in my details as it just keeps flashing between two screens.
au;5;"Install this app is less about me, more for others, it’s about reducing risks to my family and friends. When I get informed being under the risk, I can immediately avoid meeting others to make sure they are safe. If I do it for you, can you do it for your loved ones.

The app itself only requests phone Num, post code and age range. This is less than any services I sign up these days. I’m sure Gov knows more about me than these 3 things. It’s not tracking location either, it only cares about if any identified case around you so they can contact you. The virus is so aggressive, without using technology what’s our way out?"
au;5;"No issues to date with this app. Drop the leading 0 on your phone number if you’re having issues with setup. No noticeable difference on battery either. Works fine with a locked screen. It’s pretty much set and forget, just leave Bluetooth on.
If people are having issues try turning your phone “off” then “on” again."
au;1;Have to sign up every time you start the app. This will get tiresome quickly.
au;1;After starting app the screen goes dark with COVIDsafe text in the middle.
au;5;Downloaded very straight forward. Having trouble with blue tooth as keeps disconnecting when phone goes to sleep.Allow Bluetooth remains off with no ability to switch this on via app. So don’t think my app is functioning. There is no real help/troubleshooting available for the app. So have given up. I did give high rating because the concept is good!
au;5;We need to encourage as many of our friends and family to down load this App and as responsible Australia’s it’s all for one and one for all.... I have seen the best and worst in people during this pandemic we all need to accept that the world is going to be a different place when this is all over and realise that our government is doing this to keep us safe it’s not espionage it’s not some sort of conspiracy...Take  Care Everyone and Stay Healthy
au;3;So I like the idea  of this app but it sends you a notification if your Bluetooth happens to drop our reminding you to check that it’s connected! Kind of annoying especially if it happens daily. Also it would be great if it linked with the other gov one so it recognises that you already have the alert app active!
au;3;I think 1.5m doesn’t seem enough. If you put your phone on a bench it’s not going to be very accurate. It’s ok if you have your phone on your body all the time. Still confused on when the app works or not if the screen is unlocked or locked and whether it’s just the app remaining in the background 🤷🏻‍♀️
au;1;Have iPhone X, won’t verify my phone number have tried numerous times.  Have deleted app and reloaded , turned off wifi etc NOTHING Works!
au;1;I was really looking forward to helping by using this app, but for the third time this week is is asking me to sign up. I did, and it forgot - so I did it again and now it’s asking again. That 3 times in 3 days. Twice it also reminded me to open it even though it was running in the background. I don’t think it’s working.
au;1;I cannot get the app to recognise my phone number - tried everything. Hopeless.
au;1;Tried to set this app up but can’t activate because we do not have mobile phone reception.
au;5;Works as intended.  Recommended!
au;5;"Turn off WiFi and the app will verify. 
It would have been nice if the app developers had advised of this problem. 
App works well."
au;5;How lucky are we to live in Australia And to have an App like this for the health and safety of all of us is amazing. We should all be grateful that we don’t live in the USA or anywhere else at the moment. 🇦🇺 Thank you 🙏🏼
au;1;Have tried this app on my phone with and without the leading 0 and it declines my number every time. It’s a case of i can see the need for the app and want to use it but my number just does not work. 1 star till it’s fixed
au;5;Was Super easy to download and register. Hope all individuals download the app for the benefit of all!
au;5;"Never has there been a more important time or technological tool that can make a real difference to your community.

Whilst it is reasonable to ask questions about privacy and security, these have been answered comprehensively in the affirmative.

This is not a time for ideology or a contrarian view, merely for the sake of it. It is a time for practicality and pragmatism.

Do your civic duty; DOWNLOAD IT, enter your details and you’ll be helping to protect yourself and your loved ones and potentially helping to ease social restrictions ASAP."
au;2;Sign up details required every time I open the app? Giving up using it as its like I have to sign up as a new user every time!!
au;3;"I really want this to work well. I really do. But there are 2 main issues.
1. Remembering to activate it when you go out.
2. You then can’t use your phone to answer calls, reply to messages, use Wallet to pay for things, etc.

I realise that having an app with BLE running in the background is not allowed with Apple but this really needs to be escalated quickly to ensure this app can be used effectively."
au;5;Works the goods
au;5;If you want to get out of lockdown quicker and get back to normal life quicker, just download the app. You are helping not only yourself but other people. If you are worried about being “tracked” you are likely being tracked already from the social media apps you use
au;4;Yeah the fourth level where you use the sniper rifle on the terrorist is tough
au;1;Unable to register iPhone 5 & 6 running ios12. Unable to verify phone numbers. Let’s compare #downloads with registrations.
au;1;Mobile hot spot not available or interference while using this app forced me to delete it.
