au;5;"For those getting an error ""Error verifying number"" try turning off your wifi and use mobile data instead that solved it in my case and of course no leading zero on your number."
au;5;Easy to set up. Got my message this morning to tell me it was working properly, that was good for me as verification that it was setup correctly. It will do that daily.
au;1;"Not sure what the app needs my mobile number for, so I stopped at step 2 of the sign up form.

If I need to be notified the app can just send a push notification. I don’t understand why it needs any personal information instead.

Waiting for a version that’s based on Apple’s/Google’s privacy-focused exposure notification system."
au;3;It’s a  McDonalds.
au;5;"Hints for those worried....

* The government has your details already through our tax and Medicare - just download the app. 

* The app isn’t using location data, just Bluetooth to see if you came near someone - just download the app.

* No one in the government is really interested in your personal conversations with your cat. The app doesn’t record them - just download the app. 

Be a part of something to get Australia back up and running. Just. Download. The. App 😊

If you’re still scared/paranoid, then don’t. But never complain about isolation or restrictions again."
au;5;Download and help us to reopen.
au;5;Stop trying to find faults - this is for our greater safety.
au;1;"Can’t get passed confirming my details. 
Have tried all the obvious things like number with 0 first then without.  Tried different personal details."
au;5;"Every little bit helps. 
Easy to download. 
Set and forget until the time comes that you get diagnosed or called to say you have been in contact with someone who has been diagnosed.  Then the magic of contact tracing becomes so much easier. Who knows this could save someone elses life."
au;5;Just do it.
au;5;Data is stored on your phone encrypted and can only be accessed by a health professional with your permission. Also it doesn’t record personal information.
au;5;Is it worth entertaining the idea that when the app is installed but a user has not kept it active, and, or the Bluetooth bit, is not running, the app turns from its green colour scheme to another ‘alerting’ colour as part of its notification to the user?
au;5;Better be safe than sorry.
au;5;I’d like to thank the PO, BA, designer, content writer, developer, tester, QA, architect etc who know doubt worked some long nights to get this approved and out the door in such a small timeframe. I’m sure navigating it through risk, compliance and legal while still making it understandable was fun. From one who know what’s involved - I thank you!
au;5;Easy to download and set up.
au;5;"App runs in background 

People who are so worried about privacy 
Should delete there Google and Facebook accounts 😂"
au;5;Wonderful initiative by the Australian government to help slow down the spread of the virus. Will definitely save lives and allow for restrictions to be eased sooner!
au;5;Only took few seconds to setup. Stay home. Save lives. Long live JACINDA ARDERN
au;5;"Have been waiting patiently for this app that we the people have been asking for. 
Thanks for implementing it with the safeguards you have."
au;5;"Contact tracing is one of the proven methodologies to actually track the spread of the virus and isolate it’s progress. This is critical to saving lives and well worth everybody doing their bit to participate. 

App works well and without a hitch now. Thanks for making it happen."
au;5;Im sure developers did the best for protecting Australians. Protect your family and colleagues from this virus.
au;5;As I was trying to fill in details the screen would fade to black and say COVIDSafe in the centre randomly and frequently, made it really difficult to fill it out. Might be enough to stop a lot of people from completing so maybe fix that up soon
au;5;Cmon if you worried about your privacy first delete your Facebook and then stop using your gmail. Ohh wait even this wont work they already profiled you... . JUST DOWNLOAD THE APP
au;5;"Guys, government is doing the right thing, support them !
rather than supporting instagram and fb with all your deep personal data."
au;5;I’m not really in a position to rate the app, but I have downloaded as I want to band together and get our lives back to something normal. Let’s look out for each other.
au;5;Great app, easy to use and quick to register
au;1;Drains your battery really fast.
au;5;Don’t be put off by the fearful and ill-informed. For all the paranoid conspiracy theories, the fact is this app shares nothing not already known. This will help Australia get back on track. I’m happy and confident to use this app.
au;1;"I am all for this app
I have an iPhone X
I am a HCW
APP not registering my number. Where do I get trouble shooting support?"
au;1;"Like others have mentioned, the screen goes dark with text “COVIDSafe”. You have to minimise the app and launch it again to view the actual UI but it goes dark again within 2 seconds. In its current status, the app is practically useless. 

10s Max
iOS 13.3.1"
au;4;"I don’t like this government, so I’m trusting they will do what they say- this time...
  Privacy hasn’t been a concern of mine - as yet - so I’m willing to take a risk for health if others, and hope information won’t be used against me.

No glitches for me.
Used 1% of battery so far.
Apple’s unique methods of hibernation of aps in background helps."
au;4;App will have an error during registration process when you submit your mobile phone and you used an alias name with a number in it. The error message will say “Error verifying phone number” which is not a helpful error message. To fix this, simply change your alias name and remove the numbers or possibly any other special characters in it.
au;5;Quick and easy to register, the FAQ’s are super helpful and nicely formatted.
au;5;Easy Set Up.. No Lag.. Works Fine on my iPhone XS..
au;1;Just said error to send me code.
au;5;Happy to help with early detection and all the hard work the government has done to minimise the transmission makes it worthwhile.
au;4;"The app currently only works when you have it open and your iPhone unlocked.

Apple does not allow app developers to access Bluetooth from the background - so as soon as you open a different app or lock your phone, this app doesn’t work. There is a change coming, but not for another week or so. Hoping this app is updated to take advantage of the change ASAP!"
au;1;Stop downloading this app if you want to keep your civil liberties fools
au;4;I’m happy to have the app, but it needs to run in background so we don’t know it’s there. I don’t need messages telling me to be safe etc.
au;5;Works great. Easy set up.
au;5;Well thought out and easy to install. Great job 👍
au;5;Super easy to use, consent is two-fold and a great measure to tackle covid-19.
au;5;App is easy to set up. Help save Australia
au;1;"Having the app active means Bluetooth hands free in my car doesn’t work.
I don’t want to risk a fine trying to do them right thing’....."
au;5;Set up on my iPhone X in less than a minute.
au;5;Took a minute to register. Very easy.
au;5;"extremely easy to use!  Very happy with the privacy setting. If you use google, facebook or any of those types of apps....they have so much more data on you than this app collects. 
Hopefully everyone will download and we can put a stop to this damn virus!"
au;3;The app won’t start if the phone connected to WiFi
au;5;Want Australia to be set free from lockdown? Digital CV19 contact tracking is essential to do this...
au;5;Signed up very quickly. I’ve seen reviews saying that the word CovidSafe keeps coming up on the screen. This happens when you tip your phone upside down, so the screen faces down, it is to safe power. So when signing up just try to keep your phone level or screen pointing upwards and it won’t happen. Hope this helps.
au;1;"Apple Car Play no longer works. 
Message says ‘The device can no longer be used as a source in “Media”. ‘
I want to do the right thing to help the community so hopefully the developer is reading this. Please fix ASAP"
au;5;Easy. No issue for Ip8. Hope they sort out the low power mode issue if there is one.
au;2;I can’t believe that an app for-the-masses only support iOS10+ what about all the millions of older phones. With such a high number of iPhones in Australia such a limit is unwarranted. Unjustifiable laziness. Please sort this out ASAP
au;5;Working fine now, keep Bluetooth on for it to work.
au;5;"Health authorities in Australia are doing a great job. 

App seems to use little battery, so no trouble at all."
au;5;App works great on iPhone 6S. I like it. All good for now.
au;1;Doesn’t seem to work on iPhone 8 Plus. I just get the starting splash screen and that’s it.
au;5;"I’m all set up ... whoo hoo🥳. This marvellous app was very simple to download and quick to register. I hope EVERYONE downloads it as it will keep us all safe AND ALIVE. I am satisfied the Australian Government has diligently built in all the checks and balances to make this site secure - even though we only have to enter the most basic information so we can be contacted if we unknowingly come into contact with a ‘carrier’ of the deadly virus. THANK YOU, THANK YOU, THANK YOU. 💐💐💐🙏🙏🙏👍👍👍
* I would not be surprised in the least if other countries struggling to stop the carnage adopted this app."
au;3;The app seems to work, but it doesn’t lock the screen.  This can be a major security issue.  The advise is to “keep the app running”.  This will not be a good user experience to be forced to keep this app on the foreground, let alone remember to do it whenever we go out shopping.
au;5;App is really straight forward to setup and use.
au;5;It has a rough launch but has a easy set up and is simple to use. While on the topic it’s pretty entertaining to read the conspiracy theories in the other reviews. One guy was upset that it would send you a message if you came in contact with an infected person, claiming it an evil invasion of their privacy. Little by little I’m losing faith in people.
au;4;Fast and easy to set up, very user friendly. Only issue is that it drains battery life very quickly.
au;2;iPhone XS keeps flicking back to the loading screen. Other than that easy set up
au;1;Keeps coming up with an error on 3 out of 4 devices in my house, saying “error verifying phone number”
au;5;There’s no reason you shouldn’t get it
au;5;Thanks for helping to keep us safe
au;1;This app requires your screen to be unlocked and the app running to even work, which means reduced privacy and battery life and an inconvenience if you need to use other apps. It’d be much better to use the Exposure Notification API from Apple than rushing this out.
au;1;Can’t get past number verification. Apparently doesn’t work on apple
au;5;"It worked without issues on an iPhone XS. to those that espouse issues around privacy just remember that your decisions have ramifications beyond just you. If this fails then it’ll fail because people like you are choosing to make it fail. Let me know later if privacy is that important while passing away from COVID because we as a country couldn’t trace the person you caught it from due to oercieved privacy issues.

For those that have highlighted technical issues around the software you are letting perfection be the enemy of fit for purpose. I want this now, not in 4weeks time. I’m not employed by the Federal or State Government's directly or as a contractor. I am an IT guy."
au;1;Doesn’t let me consent to registration. The tick box stays blank and I can’t move to the next page.
au;5;Let’s all do this WA. Other apps you use every day track more info about you than this one does. No problems down loading was quick and easy.
au;5;"It doesn’t track you just bounces your Bluetooth.
Plus the gov really couldn’t care less about tracking you Karen. So just instal the app. It’s 30 seconds."
au;5;Good initiative by Scott Mo, good job so far
au;5;"Less than 30 seconds to install and register.
If you have ever had anything to do with Aus Gov they already have more info than this app provides them with. I used a pseudonym no problem.
It doesn’t ask to use your location services (so no, it’s not a ‘tracking app’) it only uses Bluetooth signals to ping off other app users (that’s why it asks you to keep app running in background and Bluetooth on). 
You enter your mobile number so if a user is diagnosed and they upload their data which has used Bluetooth to ping other users (in close proximity for more than 15mins) by putting our mobile numbers in, it allows the health dept. to be able to contact us, not by using a location service. 
If you have any app on your phone that uses location services it’s more invasive than this one.
You have to upload your data for it to be accessible, otherwise it is kept on your phone.
Even if it did use location services (which it doesn’t) I’d rather give access to the govt of my location for a couple of months than potentially be in ICU, or be responsible for someone else being in ICU."
au;1;Just continuously says there is an error with my mobile number.
au;1;Have tried several times to activate this app continues to come up with error verifying phone number, so far I’d rate zero
au;5;Thanks🙏
au;5;"To everyone who has downloaded this App.
Thank you so much for being a responsible Australian citizen and caring about our nation’s health.
You will make a difference!"
au;1;"Not sure why the app will not recognise my number.

Tried to register but unfortunately can’t use this app"
au;5;Awesome app easy to register, Everyone please download for the benefit of entire Australia Cheers!
au;1;"Was looking forward to using, however, can’t register passed entering my mobile phone number.. 
“Error verifying phone number”

Using iPhone 8"
au;3;Continual notification about Bluetooth possible not on as the app is not pinging any other bluetooth device, cause I’m keeping my social distance.  If it keeps happening I will delete.  And why release before safe guard legislation is in place that was a dumb mistake
au;5;Worth doing to get the country back on its feet. Location data is not shared, your privacy is kept intact (people have already explored the code to find out). Get this app and save some lives!
au;5;The more who download the safer we are.
au;5;"Easy to install and use. Installed in less time than it takes to properly wash your hands. 
Do something good for yourself and your community by installing and using this app."
au;5;I trust the government in trying to stop the spread - in full support of this app and thankful that they have released it so soon it works well and uses bluetooth to locate you - not location services!! stay home, save lives and stop the spread !!
au;5;"Easy to download and Follow Info.
No issues"
au;3;Keeping the app running is not ideal at all it should be able to run the the background. Otherwise a fantastic idea
au;1;No issues with privacy, however only taking Bluetooth links when within 1.5 meters of someone for 15minutes doesn’t seem wide enough parameters considering speed of spread. Might lead to more ignorance on both sides, government and general public.
au;5;If we all download it we will help protect each other
au;2;"Error verifying phone number when using a VPN. Tried both with and without the leading 0. 

I have read the commentary and though sceptical of the government’s goodwill and competence (which is why I use a VPN) I have decided I want to use this app. 

Couldn’t register until I disabled the VPN."
au;5;"Works fine! 
Let’s get this done together so we can all go back to our normal lives!"
au;5;Works without a drama, just had to wait till the registration went live a few hours after app hit stores
au;5;So easy to set up!
au;2;From a UX point of view I wish they had of led with the why and not the how to begin with when installing the app. An overwhelming amount of information at the beginning and having to swipe through all of that didn’t make the key message clear or incentivise installation. It’s an important tool at this time and should be simplified for those who aren’t patient or tech savvy.
au;1;Installed on an iPhone 6S. Every few seconds, the screen goes black with the words COVIDSafe in the middle of the screen.
au;5;.
au;3;"The app appears to be linked to internal sensors.

As when app is open if you tip phone past the vertical, it blacks screen with COVIDSafe watermark
Ie Upside down. So laying down looking up at phone"
au;1;Stuck on black splash screen with COVIDSafe title. The actual app only occasionally flashes up, so have not been able to set up.
au;5;Why wouldn’t you download something that gives you peace of mind and protects yourself and others?
au;5;Loads easy, don’t worry about your location privacy, it’s a little price to pay for such a huge benefit ( savings lives, livelihoods and our beautiful country)
au;5;High hopes this app allows Australia to open sooner
au;5;Let’s do this and then quicker for all of us to get out of lockdown.
au;5;Does what it says it will do.
au;5;Works fine for me.
au;3;Great idea but in less than hour my iPhone XS battery has drained 44% with no other use. Makes having the app and leaving Bluetooth on unfeasible. Need to remember to turn it on when likely you come in contact making its efficacy questionable.
au;5;wish it can turn off Bluetooth while staying home or alone to save energy
au;3;"What does this statement actually mean - “app open in power saver mode""?"
au;1;You receive a PIN text to you, and have to enter that as a verification. I entered it and it states “not valid” contact health officer for another PIN. Couldn’t find anywhere to contact for this, so not wasting time stuffing around with it.
au;5;Make the app available for all country iTunes accounts because any person visiting or a visa holder probably has their home country iTunes and if you don’t make it available to them it will limit the info. 1.6million temp visa holders are currently in Australia so it’s worth doing
au;5;"Straight off the App Store, enter a few easy details and a couple op settings to accept. 

It doesn’t get much easier to help the country to get through this, and once it’s going you need to do nothing."
au;4;"Happy to provide less info than most common apps ask for, but please... I don't want notifications unless there is a problem... I don't need to be reminded to keep my bluetooth on, when it is in fact on... 

A notification just popped up and my heart rate spiked! I want to keep notifications on to be responsive... But your app is going to get deleted if you continue!"
au;5;"Left it running in background overnight on my iPhone 6 without charging. 82% at 11pm, 67% at 7am.
I can’t see any difference to power consumption."
au;5;Easy to install. Asks to send notifications. OK.  Asks to use Bluetooth. OK. Does NOT ask to use location services! Please Download and leave running in the background so we can get back to normal Australia!
au;5;Well done the best thing that has came out of this virus 🦠
au;5;Very necessary for the current situation.  I am glad to help to fight this virus.
au;5;Easy setup on iPhone X. More people that download the quicker we can get back to normality in Australia!
au;1;Get to the registration screen and before I can enter details the screen goes black with grey lettering saying “COVIDsafe”
au;5;Straight forward to download, voluntary to use, stay safe everyone #protectingourcommunity #beinformed
au;5;"I have downloaded app extremely easy, I would recommend 
Take 10 seconds"
au;5;Make it happen!
au;5;Very easy to use. If you’re concerned about privacy you can use a fake name. It’s legal.
au;5;Super easy to download and will help us all get out and about sooner!
au;5;Just downloaded it, you can take ya tinfoil hat off.
au;5;Easy to install and register. Hope this helps to relax restrictions.
au;5;Easy to download and enter info.
au;5;"This app is one of the best ideas the government has had so far! It is easy to download and once you have done that, You don’t have to do anything else! 
Stay safe! 
Ps. Everyone wash your hands and only go out of your house if you need too!"
au;1;Can’t even register - never received the sms containing the PIN. Tried many times, even uninstalled/reinstalled. This is what you get when these things are rushed for release. 😔
au;1;My, Australian registered mobile phone number is not acceptable for some unknown reason. I have tried several times.
au;5;"Imagine if we’d all had this app, when those people were allowed off the ship. 
Or before it went through the nursing homes, or the entire country."
au;5;No issues, easy install setup. Keen to support the community together
au;5;Our numbers are down compared to other countries because of the government 's effort such as these..
au;1;The step which is supposed to send an sms for pin verification doesn’t work. Could be an issue with sms gateway & Vodafone. SMS never comes have tried 10+ times.
au;1;Cannot find link to raise support ticket. Please fix this - surely a common issue for others. Thanks
au;1;Can’t validate phone number
au;5;This app is very easy to set up on your phone. Download it to help with contract tracing
au;5;Not sure what technical difficulties others are having but mine was smooth from start to finish. Good UX.
au;5;It hardly takes 45 seconds to do everything.
au;3;Corona
au;5;Lose the hysteria. All the big corporations have way more information and I’m sure they sell it on. This app will help us get the jump on COVID which is exactly what we need
au;5;Gutten Tag iz za wokinz za fine
au;5;Easy install and doing our bit for the nation
au;3;Very buggy to start with please fix bugs
au;5;No problem here quick set up let’s ease the restrictions
au;5;Come Australia let’s do this.   The sooner we have a way to quickly identify those at risk and need of isolation, the sooner we can get back to work and play!
au;1;Every couple seconds the screen blackens and just says covid safe. Not allowing me to read/access or report issues with all its flashing
au;4;"The government’s contact tracing app seems fine, but there’s a hiccup with the blue button at the bottom you can press to send your data to the health authorities when requested. 

The app designers have (I assume) assumed that you will only press this button if you test positive to covid-19, so the first thing it says is “you have tested positive for covid-19”. 

Facebook is already awash with misunderstandings about how the app works and what it does so I’ll be curious to see whether there are edge cases wherein people see this and assume that there’s a database somewhere showing them as infected."
au;3;Can not enter a mobile number as will say it can’t verify, so can’t register
au;1;Can’t get past mobile number
au;2;Pin to verify was sent, auto added but then doesn’t work - then won’t deliver new pin :/ It has corona virus.
au;5;Works very well
au;4;"My only gripe is that the upload my information button should have had a few steps/warnings  before allowing to press the button. 
I can lots of people clicking that button accidentally and then being told they are positive."
au;5;No problems. The sooner we all do this, the better!
au;5;"iPhone 11 Max Pro, super easy required far less information than other apps. Didn’t even ask for e-mail address.  
I work in construction and believe that this app gives me the best chance to keep those at home I love safe by alerting me of any risk that I should be concerned about that I would otherwise be unaware of."
au;2;App would not accept my phone number until wifi and VPN were switched off.
au;5;"It’s only keeping details of your proximity to any other mobile with same app, need blue tooth on.

We need this technology to quickly respond to any new breakouts - but like the disease, we need the majority of aussies to be using it."
au;1;The screen goes black for every few seconds making it impossible to use. I am on iPhone X.
au;1;During registration, screen goes black with covidsafe word and can’t continue process.
au;5;I find it easy to access. Definitely recommend it to others. Good friend of mine sent it to me and I shared it with my family and friends. Hopefully soon this will over and we’ll be back to our everyday life😊 Thanks for creating this app😇
au;4;Just runs in the background. I assume it works...
au;5;Alleged privacy concerns are trivial in the face of our safety and economy. Please encourage others to load.
au;5;Downloaded and run it but it never sends me a pin to activate and use it. Help please.
au;3;Have to remember to turn wifi off - it’s the only way it finally accepted my mobile number- thanks to other reviewer for highlighting this.
au;5;Like this idea and happy to help but wasn’t working. Stuck on splash screen. Half an hour later it was fine. A temporary glitch obviously
au;5;Unbelievable how well it works. Definitely a must for anyone wanting ScoMo to expedite the lifting of social distancing restrictions 💁🏼‍♂️
au;1;It won’t verify my mobile number
au;5;I downloaded the covid19 safe app on my iPhone 7 and it seems to work well. The only details you need to share is Full Name, Phone number, post code and age range then you need to make sure Bluetooth is on at all times when you are out and about. I am somewhat concerned about privacy breaches, but hoping my privacy is safe.
