au;5;Easy to install, saw a few reviews saying they can’t proceed past the mobile number rego....it’s got the +61 Australian country code, so you don’t need to use the first 0 of your mobile number.....
au;5;And was seamless!
au;1;I try with an 0 and without. Still says there is an error....
au;5;No problems to download and register, everyone should download it, I want to keep safe
au;5;Doesn't appear to do much yet, registration went well and no issues.
au;1;"Tried several times! Same message comes up😔
Taxpayers $, Ruby v1.2"
au;5;Easy to work through. Entered mobile number without the 0 and verifying text sent. Bluetooth on. App active. Smash the curve!
au;5;Downloaded app & found it pretty straight forward to use.
au;5;Downloaded and verified OK. App was easy to setup and looks like it’ll sit in the background and do its thing.
au;5;Accepts my phone number. The media said it wouldn’t work before 6pm on the day it was released, so I just waited until then to download.
au;5;"Quick and easy. 
Works as described."
au;5;Signed on fine no problems at all
au;5;Installed and registered in less than 2 minutes
au;4;Leave the zero off the start of mobile numbers. As it’s a +61, you have to drop the zero, then it works.
au;5;No issues
au;5;Setup without a problem. Time will tell whether it keeps running on an iPhone without frequent intervention. Also, with regard to some low ratings, I suspect servers might be overloaded for the SMS verification and that’s why some people are having an issue. Just wait a day or two.
au;4;Try dropping the zero from your mobile number if having issues. . .
au;5;Used my mobile number without the 0 (due to country code being added by default) and it worked first go.
au;5;The app doesn’t track your location like everyone was worried. Much ado about nothing.
au;5;It set up without a hitch
au;5;Simple and easy to use, great initiative by the health department
au;1;Can’t use if number cannot be verified
au;5;Kind of buggy
au;4;"I found the app easy to register and read the privacy statement easily. I am curious to know how my battery use will be impacted by having Bluetooth on all the time, but we’ll see. I have a feeling all it will record is continual contacts with my husband. 
Good luck everyone and we’ll done app developers and designers."
au;5;I had success verifying my mobile number. First time I used a nickname and it failed. When I used my real name it worked. May have to match the name on your phone account?
au;5;Completed in about 2 min after reading information.  No problem with verifying my mobile number.  Remember to drop the first 0 when entering your number!  Let’s hope it works.
au;4;"It should be made clear to users during signup that +61 substitutes the leading 0 from an Australian mobile number.

This simple clear direction will ensure that all those hundreds of people claiming the app is broken can verify their mobile number successfully and help to support the goals of the app."
au;4;If you didn’t know the name of the app and you searched for the term “covid app Australia” then you get a different app. Because this other app is from government I can see where a lot of people will download it and think they are done.
au;1;Gets stuck and cannot Verify mobile
au;5;Literally took 1 minute. No issues at all.
au;2;App does not recognise my phone number. I did my husband’s phone for him and there was no problem.This needs to be fixed urgently as many potential participators will be lost.
au;4;Just downloaded the app without any problems. Perhaps people who reported a problem didn’t follow the instructions closely which require you to turn your Bluetooth on BEFORE the last step.
au;5;Earlier while entering valid phone number and it was giving error. It’s now been fixed and working.
au;5;It took me 2 mins to set up with no hassles at all.
au;5;Done in a minute
au;5;"No dramas registering with my iPhone. There’s also a great technical analysis on Twitter if you want to know the internal workings of the app. Sounds pretty similar to the papers released by Google and Apple on how they will natively allow support States/Govs to do contact tracing.

Doing my part to stop the spread of COVID-19."
au;5;"Be part of the solution
Worked perfectly and smoothly no problems"
au;4;As in the title
au;5;"Lots of negative reviews about a phone verification bug...
I had no issues when signing up myself so it has likely been fixed. Otherwise please be patient and keep trying over the next few days; everyone is trying their best and I’m sure it’ll be fixed soon if not already. It’s important not to dissuade people from downloading :)"
au;5;Easy to install. It require your name and mobile number. Total 1 minutes
au;5;Registrations opening from 6pm, comments from before this time should be disregarded, get on board Australia!
au;5;Registration opened at 6pm AEST. That’s why it didn’t work before 6pm for many people.
au;5;"Just turn of Wifi when putting your number in.
So it can handshake properly.
As when on wifi it can’t see your number.
Easy install no problems just have it on 4g"
au;5;Easy as to install even on a really old iPhone. Took all of 1 minute. Everyone should get it.
au;1;Not working, error when verifying phone number
au;5;Had no problems signing up. Just drop the 0 from your mobile number
au;1;Phone number not recognised. Gave up after multiple attempts.
au;5;Super simple to set up.  No problems. Quick & easy!
au;5;Lots of negative reviews submitted here but i gave a try and its working fine. Registered in a first go without any hassle. Thanks to Health department for taking initiative steps.
au;5;Works perfectly and only a small app. If you are unsure about it- think of the health workers that you might just save by downloading this...
au;4;The app worked fine for me?   Maybe the servers were overloaded earlier?
au;5;Everyone get this app to stop the spread and we can get out of quarantine quicker
au;5;"So easy. Just follow the links. 30sec setup- max.

I’m using an iPhone 8 . Version 13.3.1 (I think)."
au;4;You don’t need I use the 0 at the start of your mobile number.
au;4;Follow the step by step prompts for easy upload - turn on Bluetooth
au;5;No problem to register. Everything worked as it should!
au;5;There is no problem connecting to the mobile phone number(IPhone users ,with 0)
au;5;Very easy and straightforward way to protect each other. Took 60 seconds to set up
au;5;Easy to register. No problems.
au;1;Can’t get past “error verifying phone number”..
au;5;No issues with registration.  Great concept, privacy protected with no overreach.
au;2;Although it was a charge of $0.00, I don’t understand why my bank account had to be pinged . Other free apps you download without the app testing your account details. Makes me suspicious and I don’t want to be.
au;5;"It was a really smooth installation and lots of explanations of everything.

Hope it helps in this battle."
au;5;"I see a lot of complaints, I didn’t have a problem. I did automatically omit zero when entering my mobile number because it was in international format +61 4___________.
I am not sure if that is the issue that people have been having."
au;5;61 4xxxxxxxx
au;5;So easy to set up!!! Terrific stuff-thank you!
au;5;Had no trouble verifying my number. Also added my work mobile and all went smoothly. Well designed app, good amount of information without being bureaucratic. Simple but effective way to help lift restrictions and keep us all safe.
au;3;Remember if entering your phone number, do not add the (0) after the +61 then 43******* etc. not 043. You may find that it will work then.
au;5;"App works fine. Very straight forward.
Very easy to help those more vulnerable."
au;5;"Downloaded app at 8:30pm 26/04. 
No dramas at all took 3 mins total. 
My understanding (could be wrong) is the app was available  but registration wasn’t till after 6pm.

Best wishes to stay safe!"
au;5;Easy sign up, went smoothly.
au;5;Despite some reviews saying otherwise, there were no errors setting it up.
au;5;Easy to download. Hope it’s effective .
au;5;Works fine. This is a wonderful idea.
au;5;No problems encountered at all...easy process
au;3;For those who are saying it’s not working the problem is you. Enter your mobile number with the leading zero left off. The +61 takes the place of the first digit of your phone number. Basic stuff people..
au;5;"Downloaded and installed fine. Registration was straight forward and worked without issue. 

Some other reviews suggest not being able to register their mobile numbers. I think this may be because they are not dropping 0 off the front of their number as is the standard when using the international dial code +61"
au;5;Was able to register in less than 3 minutes
au;5;Great to see an easy to use and highly relevant app launched by the govt. in a timely manner.  For those with privacy concerns: you can choose to download or not but if not then one would hope you stay isolated and keep others safe. Australia has a good record in regard to respecting its citizens privacy.
au;5;Installed easily- did not face the problem of the phone number verification. It took about a minute to get the verification code though.
au;5;Can’t understand the negative feedback, I had no problems following the instructions and registering
au;5;Signed up with no issues 👍
au;5;"The app installed like a breeze. 
Let’s all work together and save lives."
au;5;I can smell the ISO freedom already.
au;3;As far as I can work out you cannot enter other mobile numbers to ignore as we have three phones and when they are in charging station overnight they all will constantly be recording and storing useless information
au;5;Let’s do our best to stay on top of this thing!
au;5;App works fine. Added my mobile phone number without the 0, my wife added the 0. It worked both ways. Got the text and entered the confirmation code. Accepted all questions. Up and running.
au;5;Easy to use and download.
au;5;"Very simple to install. 
Make sure no full stops or anything when adding your name and it will then recognise phone number."
au;5;To all those people having difficulties in entering your mobile number, it only wants a nine digit number so drop the zero at the beginning
au;5;If you don’t get this app or you have been near someone who won’t then don’t come near me thanks👍
au;1;Can’t be install great app NOT
au;5;Very easy to download, fantastic initiative. I suspect the phone number problems are user error
au;3;Signed up with no problems at all
au;5;When entering your mobile number you have to only enter the numbers after the 0. Don’t not enter the 0 just the last 9 numbers
au;4;"Very easy to set up - asks for minimal information, just first name and number. Only problem is I nearly uploaded my information at the bottom where it asks ‘has a health professional asked you to upload your information?’ I think that’s just for confirmed cases???!

Not worried at all about scaremongering of the government having my info - I have a Medicare card, bank accounts, a passport, licence etc - pretty sure I have enough for them to track me if they could be bothered! and if privacy is really a concern to you - why are you people on Facebook, Twitter, Instagram, PayPal, eBay, etc etc etc.... they have more than enough on you if they want! 

Do it - look after each other Australia - let’s not be like Europe or the USA and lose so many lives."
au;5;Drop the zero at the start of your number: +61 4????????
au;5;Don’t input the 0 at the beginning of your phone number and it will a register just fine.
au;5;This is a brilliant way to stay safe and cut the risk of spreading this dreadful pandemic
au;4;Installed and registered no problem. So maybe it’s fixed now.
au;5;To all those people who can’t understand how to enter a phone number properly then listen and learn. +61 is our region code. So all you have to do is drop the 0 from your number and enter it in. Eg. your phone number is 0412 345 678. In the app it would be +61 412 345 678.
au;5;5 stars to offset against the users below who tried to register before launch and therefore failed.
au;1;Can’t even set the thing up.
au;5;Quick and easy setup. No issues with number verification
au;4;The registration was easy. I am happy to sign up to help reduce the spread.
au;5;A great health app! Get it now and help keep Australia covid free.
au;5;"Can register fine

I dropped the first zero from the mobile number."
au;5;Note when entering your phone number you you need to leave the first zero off. No problems registering if you do this.
au;5;Registration worked fine.
au;5;Thank you mr. Morrison for keeping us safe!!
au;4;"People
Have had problems registering mobile numbers for some reason but I had no issues. 👍"
au;5;Had no problems entering my details. Nice app.
au;5;In the interest of getting people to use the app, I am reviewing to say it worked for me. I saw lots of people saying it didn’t work - it worked for me, so perhaps they’ve fixed it. Give it a go, I was able to put my number in and register without a problem. Left the 0 out.
au;5;No idea what is wrong with the other people leaving reviews. Are they entering their phone number incorrectly? Worked perfectly for me straight away.
au;5;No problem registering the first time. Got my pin within seconds.
au;4;I didn’t run into registration issues. Hope more people get on board
au;5;Super easy to Download install - took less than a minute!
au;5;No issues registering here. Let’s see how we go!
au;5;Despite the negative press, I’m happy to install the app as I am out and about seeing clients, so anything I can do to help myself and clients I’ll do.
au;4;No problems installing. Remember to drop the first zero from your mobile number when verifying, the pin came through in < 1 second
au;5;It works perfectly no issue with number
au;1;Tried multiple times to complete signing up, but keeps coming up error after I put in my mobile number...
au;5;No trouble installing and everything is clearly explained
au;5;Simple. Took 30 seconds
au;5;I registered after 6pm once the server was online and my mobile number was accepted.
au;5;Took less than a minute to sign up. Very user friendly. Not having the issue that some others have mentioned
au;5;"Simple app to install and activate. Those having issues should not include the 0 in front of their mobile numbers, because when the country code is already included, you drop the first zero in the number.

App developer should automatically check for the zero and drop it for the users."
au;5;"As was announced the app allows you to register after 6pm today.  Very quick and easy to install and register.  

No issues to report from me. Thank you Aus government for doing all you can to keep us safe."
au;5;"All those people giving this app 1 star as they were not able to complete their registration - i.e. could not enter their phone number, tried to register too early. They did not bother to actually read or listen to any information when the app was launched.
Negative reviews written early on the 26/4/2020 referencing contact number issues should simply be IGNORED."
au;5;Get me back a more normal life sooner? Sign me up! Was easy to register and activate, and clear instructions on how to use.
au;5;I presume the app will do what it says and only time will tell if the data is as secure as they say. Very easy to install. Suspect the large number of 1 Star reviews are from ignorant people who put potential privacy above the health of the community.
au;1;Given no time to set verification number-..2nd attempt failed also 😡
au;5;Works fine, easy to register. Everyone who is saying it didn’t work it was because it wasn’t going “live” to enter your mobile number until 6pm EST.
au;5;Easy to install. Great concept.
au;1;Was only a matter of time really. We will just sit here and swallow it then ask for more. The sheeple have spoken
au;5;Everyone reporting they couldn’t register their mobile didn’t read that they had to wait until 6pm to register. It works fine. P.S. always keep the app open in the background.
au;5;"Why are so many of you complaining about the app not taking your mobile number and giving this 1 star? Yes it happened to me also 3 hours ago, but I knew that of course they will get it sorted out. 

Take a breath, and look at what this app is going to be doing. 

This app will help us get back to a closer normal sooner. So let’s all look on the bright side of this situation. We are not in the same boat - but we are in the same storm. I’m in the “optimistic” boat. Who’s with me?"
au;5;Quick and easy to register. Worked first time.
au;5;Installs, registers and appears to work as it is meant to. No issues so far.
au;5;Needs to written out without spacing and if that doesn’t work, try without the ‘0’
au;1;App won’t accept my mobile number. Have reinstalled multiple times - very frustrating.
au;5;Easy to install and setup. Mobile phone number issue has not been activated, so it works well!
au;5;Great idea, hope the issues others are facing have been quickly fixed. It worked for me straight away.
au;5;The Australian International Dialing Code +61 is part of the mobile phone number registration, therefore, don’t include the 0 at the beginning of your mobile number, that is the reason why so many of you are having registration issues.
au;5;Just downloaded and registered, no issues (yet). Make sure you don’t include zero at start of your mobile number for verification.
au;5;Those with unfounded complaints about privacy need to seriously reconsider their priorities.
au;5;Had no problem activating with my phone number. Make sure you omit the 0 at the start of the number.
au;5;Worked well- easy to set up. Joining the COVID fight 💪🏼🦠
au;5;Perfect install. No troubles
au;5;Set this up in a few minutes. Had no trouble with registering phone number. Hope this technology helps keep the numbers down.
au;5;The app launched at 6pm but was available on the App Store earlier than that. If you couldn’t verify your mobile number probably you were trying before the 6pm start time. Try again now.
au;5;Simple, fast, easy 😊
au;5;Easy to install, no issues entering phone number, just knock the 0 off your number before entering.
au;5;Logged in and working. Let’s see what happens next. I have given more personal details to business around the world that I trust a lot less than the Australian government.
au;5;Easy to download and register
au;4;Quick and easy to download. Had an error message on first try but came back 10 minutes later and it was fixed.
au;5;"Easy to use took me 20 seconds to register. Wasn’t hard at all. 
PS don’t put the 0 at the start of your mobile number."
au;4;It’s working for me 26/4/20 20:50AEST Apple IPhone 6
au;5;I’ve seen a lot of comments about being unable to register. The issue appears to be fixed.
au;5;There was a clear instruction not to register your phone number til after 6pm so pretty much every review can be disregarded and it’s working fine.
au;5;So far so good !
au;5;Worked first go. No issues verifying my phone number.
au;5;Hopefully it helps us all stay safe. Strong privacy protection. Everyone should install it ASAP.
au;5;Several people have said app not verifying phone number. Asking for +61 number. Leave out the zero at beginning of mobile number and enter remaining digits. Firstly came up with error message and then was immediately sent verification PIN number. Once I entered and verified pin it confirmed registration success!
au;5;Download this so we can get our freedom back
au;4;Very difficult to locate in the App Store if you don’t know the exact name.
au;5;"Nil issues with registration. 
Let’s do the right thing and get back to normal life again soon."
au;4;"Mobile verification seems to be working for me. When prompted for the number I left out the ‘0’ at the beginning of my number. 

Though I did experience the ‘COVID-19’ splash screen keep popping up and going away during my registration process. Seems to be only at the registration process so it was all good afterwards."
au;5;"Really simple to register, clear interface. 

Heard some people tried to register before 6pm on the day of launch, even though it was announced it would only work from then. Assume that’s why there are some 1-star ratings, but all working now."
au;5;Some reviews mentioned problems with registration, but I am using ios and I didn’t have any problems.
au;5;Looks good !
au;5;"Downloaded, installed and registered in seconds. 
To all those who can’t register their mobile number... remove the 0 if you see +61 prefix...
🤪"
au;5;Took only half a minute to set up, no problems despite reviews earlier saying that had problems (I’m using an old iPhone)
au;5;A lot of people had problems, but it worked perfectly for me.
au;5;"The following information 
“ When the app recognises another user, it notes the date, time, distance and duration of the contact and the other user’s reference code. The COVIDSafe app does not collect your location.”
should repeat that phone
“nor records the phone number of a person in Bluetooth vicinity”
You should as well inform clearly what is recorded at the central server during registration (unique ID allocated during registration, and other data provided at that time: phone no, name, post code of normal location)

Public announcements should warn about multiple similar application (one from Abu Dhabi seems to allow register Australian phone number) and clearly promote to look for Australian Health Dpt as owner/supplier and make icon of this app visible through whole promotion"
au;5;Phone number worked fine for me. Left out the leading zero if that helps
au;5;"“Andrew, I’m sorry, you’ve had several questions,” the prime minister said. “Andrew, I’m sorry, Andrew. I know, but you don’t run the press conference, OK? So I’m going to go to other questions of members of the group. Katharine hasn’t had a question,”
“I’m happy to return to you but let’s just keep it civil. Katharine?”"
au;5;Download this app so we can get busy with living
au;5;No problem downloading and registering. Code came through within seconds. Easy process (for me anyway)
au;5;Working ok for me! 26/4 8:45pm
au;5;Downloaded and registered with no dramas
au;5;"App works great, phone verified instantly, doesn’t drain battery. If you’re worried about privacy I suggest going back to your home screen and deleting every other app on your phone too.

Whatever it takes to get out country running again."
au;5;I just hope everyone else uses it too, so we can get back to normal faster.
au;5;Everything worked, the whole thing took 30 seconds, not sure why all these other people are having issues.
au;5;The app is simple to use and works well!
au;5;"Signed up . No problems, iOS current version all good with mobile number & verification pin via mobile #.
Looking forward to getting back to a few normal things, starting to look like Casper!"
au;5;The app is easy to setup, no issues
au;1;Can’t get past the verify mobile screen!
au;5;Quick and simple install and setup using iOS.
au;3;Won’t accept phone number to send pin on iphone - amended star as now working.
au;5;"Are the people getting a sign up error dropping the zero from their phone number? 
It has the +61 so don’t include 0
Like 404 123 123"
au;5;Logging in was a breeze. No problem at all.
au;5;Easy to set up and nice interface
au;4;I had no trouble setting it up, let’s hope it helps.
au;5;Simple to install, SMS message with confirmation code came through straight away. So easy.
au;5;It appears that any initial registration errors have been fixed.
au;5;Write your number slowly, I had to try it. It works :)
au;5;I was able to download & install first attempt
au;5;Must have fixed the early issues as I completed registration in a few minutes with each step clearly explained.
au;4;"To all the muppets who can’t verify their mobile number, it’s because you are a muppet, not that the app is broken.
I guess you’ve never been overseas before.
When your number is prefixed with +61, you drop the zero at the start of your mobile number.
ENTER YOUR PHONE NUMBER WITHOUT THE ZERO AT THE START."
au;4;Include the “0” in your phone number and it’s takes 1 min to setup and verify.
au;5;Hurry and download Australia so I can stop washing my hands!
au;5;"No issues with registering 
Possibly all the problems others were having was a high demand issue"
au;5;Not sure what the problem with the phone number was? Surely the ‘+61’ part wasn’t confusing people? Just drop the first digit idjits!
au;5;The app only started accepting registrations from 6pm AEST Sunday 26th April. If it didn’t work it should now.
au;5;"Downloaded and signed up within a couple of mins. 

Looks well designed app and hope it and I can play my part to keep all safe and get back to some kind of normal. 

As a chauffeur driver it’s great to know if I have been exposed."
au;5;No problems registering on a Telstra/iPhone device 6:40pm 26/04
au;5;Excellent app
au;5;Took 20 seconds to register. You can’t say that about most apps. People need to take a reality check on privacy concerns - particularly if they are on social media.
au;5;Sign up to save lives and get Australia moving again.
au;5;Only errors if you downloaded before 6pm. They said it would be ready from 6pm for anyone that wants to leave the house in 2020. Otherwise please do not leave your house for the next 8 months.
au;5;Quick and easy to install
au;5;Took me literally 5 seconds to sign up.
